lable,review
1,這次正式排除了生化武器實驗室的可能性
1,《盟國程度》美國的媒體報導
1,美國過渡政治化當時的新冠病毒的起源
1,我們來看一下報導
1,長達三年的新冠溯源拼圖
1,科學家捨棄了美國長期流傳指控的武漢生化實驗室卸出病毒的陰謀論
1,一具當地留下的DNA找到了最重要的一塊
1,大西洋樂刊用迄今最強證據
1,新冠病毒是從動物引發的大流行病作為標題
1,大篇福報導近期一份源自中國的基因樣本分析
1,我們發現了一些很有趣的東西
1,包括極章狗和別的DNA和材料
1,那些Covid-2的材料
1,根據《紐約時報》報導
1,最新分析的樣本源自三年前的武漢市場
1,當時是從運送動物籠子的手推車
1,採集到新冠病毒檢測呈現養性的勢子
1,但相關內容卻相隔三年才被悄悄上傳到國際資料庫
1,在3月20日發佈的這份重磅報告
1,認為這些證據確實強化了非法交易野生動物引發新冠疫情的說法
1,但當國際反對是途徑一步點起起義
1,最初上傳員使資料的中國科研人員
1,卻已將資料徹底刪除
1,WHOD時間譴責中國官員隱匿
1,但也承認新德基因資料似乎不能證明核感染了新冠病毒
1,且就算核真的感染了
1,使人類感染病毒的也可能是其他動物
1,或者是感染了該病毒的人傳染給核
1,這些證據不準確的證據
1,是關於新冠病毒的結構
1,美情報機關對於新冠病毒是否為實驗室外泄
1,或動物感染造成看法不一
1,但總統拜登一簽數法案
1,要求將新冠疫情及武漢病毒研究所之間
1,潛在關聯的情報解密
1,試圖借由徹底釐清新冠起源
1,預防未來可能疫情
1,因為這個病毒和人性一樣善變
1,儘管當下全球確診死亡數
1,已降至可控水準
1,各國醫療體系也在不斷演練中
1,培養出越來越高的韌性
1,但在可預見的未來
1,新冠病毒仍會與我們停載
1,即便我們已經無需強制戴口罩
1,這些證據實際上
1,對於歐米克萊的證據
1,基本上三百分之三十五
1,人的流氓有什麼強化
0,美總統拜登日前率先宣佈
0,將於5月11日終止新冠緊急狀態
0,不只將不會強制個人
0,佩戴口罩或接種疫苗
0,對新冠個案也將不再要求檢測
0,或以公費使用藥物
0,白宮方面強調
0,結束新冠緊急狀態
0,並不代表新冠病毒
0,已經不再是一個問題
0,月流九十多天的時間
0,布地在於讓公衛體系
0,逐漸恢復到昔日的運作狀態
0,因為當下的美國
0,無論疫苗 口罩 快篩 藥物
0,防疫意識及教育等相關準備工作
0,都很難在短時間內做到完備
0,他們必須盡速讓生活恢復常態
0,而整個社會安全網的千瘡百孔
0,也向瞬間被動大檢視一般
0,甚至丟關南方邊境門戶
0,洞開的四十二條
0,也將因新冠緊急狀態終止而消失
0,一切問題都將從5月開始
